web_url,pub_date,organizations,subjects,headline,snippet,group
https://dealbook.nytimes.com/2009/12/14/ny-mellon-chief-said-to-be-in-lead-for-bofa-post/,2009-12-14T10:45:25+0000,Bank of America Corp | Bank of New York Mellon Corp,Appointments and Executive Changes,N.Y. Mellon Chief Said to Be in Lead for BofA Post,"Bank of New York Mellon’s chief executive, Robert Kelly, is the front-runner to succeed retiring Bank of America chief Kenneth Lewis, but compensation issues could get in the way of a deal, The Wall Street Journal reported.",2
https://dealbook.nytimes.com/2009/12/14/citis-internal-memo-on-repaying-bailout-money/,2009-12-14T12:28:09+0000,Citigroup Inc | Treasury Department,Emergency Economic Stabilization Act (2008) | United States Economy,Citi’s Internal Memo on Repaying Bailout Money,DealBook has obtained Citigroup’s internal memo to employees about its deal to repay $20 billion of bailout money.,2
https://dealbook.nytimes.com/2009/12/16/500-million-in-bonds-sold-in-2-hours-for-nets-arena/,2009-12-16T10:19:41+0000,Barclays PLC | National Basketball Assn | New Jersey Nets,Stadiums and Arenas | Stocks and Bonds,$500 Million in Bonds Sold Fast for Nets’ Arena,"Almost six years after he bought the Nets with plans to move the team to Brooklyn, the developer Bruce C. Ratner and a local development corporation sold more than $500 million in tax-exempt bonds to finance a new arena there.",2
https://dealbook.nytimes.com/2009/12/16/ims-health-sets-date-for-buyout-vote/,2009-12-16T11:19:08+0000,IMS Health Incorporated,"Mergers, Acquisitions and Divestitures",IMS Health Sets Date for Buyout Vote,"IMS Health, the health care data company, said Tuesday that it would hold a special meeting Feb. 8 to vote on a $4 billion buyout offer.",2
https://dealbook.nytimes.com/2009/12/16/abu-dhabis-billions-said-to-buy-dubai-bonds/,2009-12-16T12:17:05+0000,Dubai World,Government Bonds,Abu Dhabi’s Billions Said to Buy Dubai Bonds,"Dubai borrowed $10 billion from Abu Dhabi this week by selling its neighbor five-year bonds paying an annual interest rate of 4 percent, a person close to the government, who is familiar with the transaction, told Bloomberg News.",2
https://bits.blogs.nytimes.com/2009/12/31/dell-customers-fume-over-late-holiday-orders/,2009-12-31T21:56:01+0000,Dell Inc,,Dell Customers Fume Over Late Holiday Orders,PC shipment problems plaguing Dell before Christmas appear to be stretching into the new year.,2
https://www.nytimes.com/2010/01/04/business/04cohen.html,2010-01-04T02:57:04+0000,RCA,"Divorce, Separations and Annulments | Ponzi Schemes | Hedge Funds | Securities and Commodities Violations | Suits and Litigation",Billionaire’s Ex-Wife Hires New Lawyer in Civil Suit,"The former wife of Steven A. Cohen, the billionaire hedge fund founder, has a new lawyer in her suit against him.",2
https://dealbook.nytimes.com/2010/01/04/europe-seems-set-to-approve-krafts-cadbury-bid/,2010-01-04T16:04:06+0000,Cadbury Plc | KRAFT FOODS | Mars Inc,Chocolate | Regulation and Deregulation of Industry,Europe Seems Set to Approve Kraft’s Cadbury Bid,"Kraft Foods appears likely to win conditional regulatory approval from the European Union this week for its hostile $16 billion takeover bid of the candy maker Cadbury, Reuters reports, citing an unidentified person familiar with the situation.",2
https://dealbook.nytimes.com/2010/01/05/bofa-chief-disagrees-with-calls-for-bank-break-ups/,2010-01-05T10:38:05+0000,Bank of America Corp,Banks and Banking | Regulation and Deregulation of Industry,BofA Chief Disagrees With Calls for Bank Breakups,"Brian Moynihan said the financial industry needed to embrace a looming regulatory overhaul instead of fight it, but added that breaking up the biggest United States banks would be a mistake.",2
https://www.nytimes.com/2010/01/07/business/media/07adco.html,2010-01-07T03:40:01+0000,Consumer Reports,ADVERTISING AND MARKETING | Magazines | Television,Infomercial Products Take One on the Chin,"Consumer Reports does not recommend the blanket with sleeves and more than a dozen other items offered in TV infomercials, except the PedEgg.",2
https://dealbook.nytimes.com/2010/01/07/the-federal-reserve-bank-of-ne/,2010-01-07T11:11:12+0000,AMERICAN INTERNATIONAL GROUP | Federal Reserve Bank of New York | Goldman Sachs Group | Societe Generale,Banks and Banking,N.Y. Fed Told A.I.G. Not to Disclose Swap Details,"The Federal Reserve Bank of New York, then led by Timothy Geithner, told American International Group to withhold details from the public about the bailed-out insurer’s payments to banks during the depths of the financial crisis, e-mails show.",2
https://dealbook.nytimes.com/2010/01/08/new-investment-tools-approved-by-regulator-in-china/,2010-01-08T18:00:45+0000,China Securities,Derivatives (Financial Instruments) | Futures and Options Trading | Regulation and Deregulation of Industry | Short Selling | Stocks and Bonds,New Investment Tools Approved by Regulator in China,China took a major step Friday toward making its capital market system more sophisticated and perhaps more stable as it agreed to give investors a new and powerful set of risk-management tools.,2
https://dealbook.nytimes.com/2010/01/11/are-they-really-sorry/,2010-01-11T09:09:27+0000,Bank of America Corp | Goldman Sachs Group | Time Warner Inc,Executives and Management,Are They Really Sorry?,"Wall Street has a lot to apologize for, but contrition would be more convincing if it came with accountability, The New York Times says in an editorial.",2
https://dealbook.nytimes.com/2010/01/11/another-claim-of-prosecutorial-misconduct/,2010-01-11T14:00:22+0000,Broadcom Corporation | Galleon Group | Justice Department | McKinsey & Co,Decisions and Verdicts | Stock Options and Purchase Plans | United States Attorneys,Another Claim of Prosecutorial Misconduct,"Peter J. Henning, a professor at Wayne State Law School and author of DealBook’s White Collar Watch, examines another claim of prosecutorial misconduct in the options-backdating trial of the former chief executive of KB Homes.",2
https://bits.blogs.nytimes.com/2010/01/11/venture-capitalists-eye-the-doctors-office/,2010-01-11T16:13:18+0000,Apple Inc | Cisco Systems Inc,,Venture Capitalists Eye the Doctor’s Office,"Venture capitalists are investing in health care start-ups, from robots that substitute for nurses to health care on the iPhone.",2
https://dealbook.nytimes.com/2010/01/12/chinas-shanda-games-snaps-up-mochi-media/,2010-01-12T10:55:38+0000,ACCEL PARTNERS,"Mergers, Acquisitions and Divestitures",China’s Shanda Games Snaps Up Mochi Media,"Shanda Games of China has agreed to buy Mochi Media, a U.S. online game company backed by venture firms Accel Partners and Shasta Ventures, for $80 million in cash and stock.",2
https://www.nytimes.com/2010/01/13/business/global/13saab.html,2010-01-13T00:30:41+0000,Saab Automobile AB | Spyker Cars | General Motors,,Dutch Carmaker Still Pushing to Buy Saab,"G.M. is winding down the Swedish carmaker, but Spyker says it has an offer on the table and wants a decision.",2
https://www.nytimes.com/2010/01/14/business/14goerke.html,2010-01-14T03:52:36+0000,Campbell Soup Co,Deaths (Obituaries),"Donald Goerke, Creator of SpaghettiOs, Dies at 83","In 35 years at Campbell Soup, Mr. Goerke created SpaghettiOs and Chunky soup.",2
https://bits.blogs.nytimes.com/2010/01/15/verizon-speeds-up-text-message-donations-to-haiti/,2010-01-15T20:12:37+0000,AMERICAN RED CROSS | Verizon Communications,,Wireless Companies Speed Up Texted Haiti Donations,"Text-message donations can take 90 days to process, but Verizon says it is writing a $2.1 million check to the Red Cross.",2
https://dealbook.nytimes.com/2010/01/19/capmark-unit-files-for-chp-11-inks-deal/,2010-01-19T08:41:42+0000,Capmark Financial Group,,"Capmark Unit Files for Chapter 11, and Signs Deal","Capmark Investments, a unit of the bankrupt commercial property lender Capmark Financial Group, filed for bankruptcy in a bid to sell its management contracts and interests in real estate equity funds.",2
https://dealbook.nytimes.com/2010/01/20/patience-pays-off-in-krafts-pursuit/,2010-01-20T07:13:20+0000,Barclays PLC | Cadbury Plc | Citigroup Inc | Deutsche Bank AG | HSBC Holdings PLC. | KRAFT FOODS | Moody's Investors Service Inc | Nestle SA,,Patience Pays Off in Kraft’s Pursuit,"It may have taken Kraft Foods four months to win Cadbury, but the delay had its benefits, Breakingviews says.",2
https://bits.blogs.nytimes.com/2010/01/21/google-or-not-motorola-pushes-forward-on-android-in-china/,2010-01-21T19:54:33+0000,Baidu Inc | China Unicom (Hong Kong) Ltd | Google Inc | Motorola Inc,Cellular Telephones | Computers and the Internet | Google Phone | Search Engines | Wireless Communications,"Google or Not, Motorola Pushes Forward on Android in China",Motorola unveiled an applications store in China for its phones that run Google’s Android software. The moves position the company to support Android even if Google leaves that country.,2
https://dealbook.nytimes.com/2010/01/25/spyker-shares-surge-again-on-saab-hopes/,2010-01-25T12:05:41+0000,European Investment Bank | General Motors | Muller | Saab Automobile AB | Spyker Cars,,Spyker Shares Surge Again on Saab Hopes,"Shares in the small, loss-making Dutch luxury carmaker Spyker Cars surged again Monday on hopes the company’s owners will reach a deal to buy Saab from General Motors.",2
https://www.nytimes.com/2010/01/26/business/global/26air.html,2010-01-26T03:55:57+0000,British Airways PLC,Strikes | AIRLINES AND AIRPLANES | Organized Labor,British Airways Is Training Employees as Fill-Ins if Attendants Strike,"As cabin crews vote on whether to begin a strike, the airline has started training employee volunteers to take their place if the union decides to walk out.",2
https://www.nytimes.com/2010/02/02/technology/companies/02google.html,2010-02-02T00:44:40+0000,Google Book Search | Google Inc | European Commission | European Union,,"In Europe, Challenges for Google","On issues like privacy, copyright protection and the dominance of its search engine, Google is increasingly clashing with lawmakers and regulators.",2
https://dealbook.nytimes.com/2010/02/03/fsa-said-to-play-hardball-on-bank-bonuses/,2010-02-03T08:22:17+0000,Financial Services Authority,,British Regulator Said to Play Hardball on Bonuses,"The Financial Services Authority of Britain has told banks in the City to cooperate in deferring 60 percent of all pay, regardless of contractual obligations, or risk having their banking licenses withdrawn, The Telegraph reports, citing unidentif...",2
https://bits.blogs.nytimes.com/2010/02/05/chinese-fir-claims-apple-stole-ipad-design-and-name/,2010-02-05T18:45:04+0000,Apple Inc,Computers and the Internet | iPad | iPhone | Tablet Computers,Chinese Firm Claims Apple Stole iPad Design and Name,"Usually, it’s a Western company accusing a Chinese company of stealing its designs. This time, a Chinese firm says that Apple stole the name and design of the iPad.",2
https://dealbook.nytimes.com/2010/02/08/pncs-bailout-warrants-may-fetch-253-million/,2010-02-08T22:32:44+0000,Goldman Sachs Group | PNC Financial Services Group Inc | Treasury Department,Auctions | Banks and Banking | Subprime Mortgage Crisis | Troubled Asset Relief Program (2008),PNC’s Bailout Warrants May Fetch $253 Million,"The government’s warrants for the PNC Financial Services Group, acquired in the banking bailout, may raise $253.3 million for taxpayers if they go up for auction, according to Pluris Valuation Advisors.",2
https://www.nytimes.com/2010/02/09/health/policy/09hospital.html,2010-02-09T01:29:01+0000,North Shore-Long Island Jewish Health System | United Healthcare Insurance Co | Senate | House of Representatives,Reform and Reorganization | Medicare | Medicine and Health | Health Insurance and Managed Care | Hospitals,"Bills Stalled, Hospitals Fear Rising Unpaid Care","While the debate continues in Washington, health care systems nationwide struggle to offset money spent to treat patients who cannot afford to pay their bills.",2
https://dealbook.nytimes.com/2010/02/12/air-products-revises-its-airgas-lawsuit/,2010-02-12T12:03:07+0000,Airgas Incorporated | Cravath Swaine & Moore | Goldman Sachs Group,"Mergers, Acquisitions and Divestitures | Stock Options and Purchase Plans",Air Products Revises Its Airgas Lawsuit,"While Air Products’ takeover bid for Airgas only officially went hostile Thursday morning, its aggressive legal action against its target heated up Thursday evening with a new set of arguments, including a defense of its legal counsel and an attac...",2
https://www.nytimes.com/2010/02/15/business/media/15carr.html,2010-02-15T00:42:14+0000,Vice,Magazines | News and News Media | Computers and the Internet,Inviting In a Brash Outsider,"Vice magazine’s libertarianism and cultural literacy brings to mind Playboy in its prime, mixing nudity with in-depth reports from the world’s most troubled spots.",2
https://dealbook.nytimes.com/2010/02/17/tax-question-arises-over-sale-of-an-a-i-g-unit/,2010-02-17T10:40:38+0000,AMERICAN INTERNATIONAL GROUP | AMERICAN LIFE INSURANCE CO | Internal Revenue Service | MetLife Inc,,Tax Question Arises Over Sale of an A.I.G. Unit,"American International Group’s efforts to sell one of its biggest life insurance companies to pay back its rescue loans are snagged on a tax issue that may require a special ruling by the Internal Revenue Service, The New York Times reported.",2
https://www.nytimes.com/2010/02/19/business/19toyota.html,2010-02-18T16:33:22+0000,House of Representatives | Toyota Motor Corp,Recalls and Bans of Products | Automobiles,Toyota Chief Agrees to Testify Before House Panel,Akio Toyoda accepted an invitation to testify at a hearing next week in the aftermath of the recall of millions of cars.,2
https://dealbook.nytimes.com/2010/02/19/vook-e-book-start-up-raises-2-5-million/,2010-02-19T19:17:39+0000,Vook,Electronic Books and Readers | Start-ups,"Vook, an E-Book Start-Up, Raises $2.5 Million","From Bits: Vook, a maker of multimedia e-books, said Friday that it had raised $2.5 million in seed funding from a group of prominent Silicon Valley and New York investors",2
https://dealbook.nytimes.com/2010/02/24/a-i-g-was-blindsided-by-backlash-ex-spokesman-says/,2010-02-24T12:35:56+0000,AMERICAN INTERNATIONAL GROUP,Emergency Economic Stabilization Act (2008) | Subprime Mortgage Crisis,"A.I.G. Was Blindsided by Backlash, Ex-Spokesman Says","The American International Group was largely caught off guard by the populist backlash that arose after it received a multibillion-dollar bailout, the insurance giant’s ex-spokesman said at a forum, according to Bloomberg News.",2
https://dealbook.nytimes.com/2010/02/24/bernanke-reaffirms-extended-period-of-low-rates/,2010-02-24T15:24:21+0000,Federal Reserve System | House Financial Services Committee | House of Representatives | Senate,Credit | Economic Conditions and Trends | Interest Rates | United States Economy,Bernanke Reaffirms ‘Extended Period’ of Low Rates,"Ben S. Bernanke, making his first appearance before Congress since the Senate confirmed him last month to a second term as chairman of the Federal Reserve, reaffirmed on Wednesday that short-term interest rates would remain at a historically low p...",2
https://dealbook.nytimes.com/2010/02/25/hedge-funds-slam-short-sale-rule/,2010-02-25T11:04:33+0000,California Public Employees Retirement System | Goldman Sachs Group | Securities and Exchange Commission,,Hedge Funds Slam Short-Sale Rule,"While the S.E.C.’s decision to impose new restrictions on short-selling had some lawmakers arguing that it didn’t go far enough, hedge funds and other investors who lobbied against the measure argued that the new restrictions weren’t adequately ju...",2
https://dealbook.nytimes.com/2010/02/25/on-wall-street-a-romance-with-the-curling-stone/,2010-02-26T01:44:59+0000,Bank of America Corp | Bank of New York Mellon Corp | Citigroup Inc | CNBC | Goldman Sachs Group | Treasury Department,Banks and Banking | Curling | Olympic Games (2010),"On Wall Street, Romancing the (Curling) Stone","Olympic curling competition has captivated Wall Street thanks to CNBC, which switches to curling coverage after the closing bell.",2
https://dealbook.nytimes.com/2010/02/26/greek-debt-and-a-weak-job-sector-weigh-on-investors/,2010-02-26T09:44:51+0000,Citigroup Inc | Goldman Sachs Group | ING Groep NV | Moody's Investors Service Inc | Standard & Poor's Corp,,Greek Debt and U.S. Job Sector Weigh on Investors,"A tense day for Wall Street ended with a tinge of hope, as a rise in commodity prices helped temper anxiety about Greek debt and the American jobs market, The New York Times reported.",2
https://dealbook.nytimes.com/2010/02/27/a-i-g-chairman-critiques-pay-caps/,2010-02-27T20:43:06+0000,AMERICAN INTERNATIONAL GROUP,Executive Compensation | Executives and Management,A.I.G. Chairman Critiques Pay Caps,"The chairman of the American International Group, Harvey Golub, wrote in a letter to the insurer’s shareholders that the firm has sometimes been hurt by government-imposed compensation limits, yet anticipates being supported by the government for ...",2
https://dealbook.nytimes.com/2010/03/01/lehmans-domestic-drama/,2010-03-02T00:41:16+0000,Lehman Brothers Holdings Inc,Executives and Management | Subprime Mortgage Crisis,Lehman’s Domestic Drama,"The battles by Lehman Brothers to save their firm are well-known at this point, thanks to scores of newspaper articles and books on the financial crisis. Now Vanity Fair has shone a light on the equally fascinating fighting among their wives.",2
https://dealbook.nytimes.com/2010/03/02/bain-capital-to-buy-dow-unit-for-1-63-billion/,2010-03-02T14:18:37+0000,Bain Capital | Dow Chemical Co,"Mergers, Acquisitions and Divestitures",Bain Capital to Buy Dow Unit for $1.63 Billion,"Bain Capital said Tuesday that it has agreed to buy Styron, a Dow Chemical unit that makes plastics and rubber, for $1.63 billion in cash.",2
https://www.nytimes.com/2010/03/04/business/global/04ecb.html,2010-03-04T05:59:09+0000,European Central Bank,Banks and Banking | Economic Conditions and Trends | Interest Rates | Credit,Cautious Steps Expected on Bank Liquidity in Europe,The European Central Bank may be ready to return to competitive bidding to set the interest rate on three-month loans to banks.,2
https://dealbook.nytimes.com/2010/03/04/eu-to-meet-with-banks-over-cds-market/,2010-03-04T10:31:07+0000,European Commission | European Union,,"In Europe, a Meeting With Banks Over Default Swaps","Raising the possibility that there were “inherent problems” in the market for credit-default swaps, the European Commission said Wednesday that a meeting would soon be called to discuss CDS’s and their links to sovereign debt.",2
https://www.nytimes.com/2010/03/05/business/05toyota.html,2010-03-05T03:39:22+0000,Toyota Motor Corp | National Highway Traffic Safety Administration,Defective Products | Accidents and Safety | Automobiles,Inquiry Into Toyota’s Fixes,The number of complaints of unintended acceleration in Toyotas that have already been repaired has risen to 60.,2
https://www.nytimes.com/2010/03/06/business/economy/06stimulus.html,2010-03-06T00:58:22+0000,General Motors,Shutdowns (Institutional) | Automobiles | Unemployment | Economic Conditions and Trends | United States Economy | American Recovery and Reinvestment Act (2009) | Labor and Jobs,"For Auto Towns, Emissary Is Ambassador of Hope",Edward B. Montgomery is helping depressed former assembly towns tap federal money to build new futures.,2
https://bits.blogs.nytimes.com/2010/03/09/foursquare-introduces-new-tools-for-businesses/,2010-03-09T15:17:14+0000,Brooklyn Museum | Facebook.com | Foursquare | Twitter,Restaurants | Social Networking (Internet),Foursquare Introduces New Tools for Businesses,"Foursquare, a location-based social network, is rolling out new tools that will give businesses more information about their customers and allow them to target special offers.",2
https://bits.blogs.nytimes.com/2010/03/11/investors-bet-on-betaworks-a-new-york-tech-incubator/,2010-03-11T17:00:53+0000,Draper Fisher Jurvetson | Intel Corp | New York Times | Twitter,,"Investors Bet on Betaworks, a New York Tech Incubator","Betaworks, the start-up incubator that helped spawn TweetDeck and Bit.ly, raises $20 million.",2
https://dealbook.nytimes.com/2010/03/18/hedge-fund-rules-arent-dead-minister-says/,2010-03-18T06:34:37+0000,European Parliament,,"Hedge Fund Rules Aren’t Dead, Minister Says","Hedge funds and private equity may have won a short reprieve after EU finance ministers agreed to delay a decision on new rules for the industry, but the proposals aren’t dead, Jean-Paul Gauzes, a French member of the European Parliament, told Blo...",2
https://www.nytimes.com/2010/03/20/business/20surveillance.html,2010-03-20T02:31:14+0000,Cabela's | Envirosell | Cisco Systems Inc,Customer Relations | Shopping and Retail | Recordings and Downloads (Video) | Consumer Behavior | Privacy | Cameras,"In Bid to Sway Sales, Cameras Track Shoppers","Retailers say they are using video cameras to watch customers as a way to make shopping in stores more enjoyable, but privacy advocates are skeptical.",2
https://dealbook.nytimes.com/2010/03/22/citi-said-to-hire-ex-nomura-banker-for-asia/,2010-03-22T07:27:30+0000,Citigroup Inc | Nomura Holdings Inc,,Citi Said to Hire Ex-Nomura Banker for Asia,"Citigroup hired Nomura Holdings’s Colin Banfield as head of mergers and acquisitions for the Asia-Pacific region, two people with knowledge of the matter told Bloomberg News.",2
https://dealbook.nytimes.com/2010/03/22/ubs-may-set-up-new-renmibi-fund/,2010-03-22T09:05:16+0000,Carlyle Group,,UBS May Set Up New Renminbi Fund,"As it looks to increase its presence in China, UBS could set up a renminbi-focused private equity fund and is holding discussions with Beijing’s municipal government on the matter, The Financial Times reported.",2
https://www.nytimes.com/2010/03/23/business/global/23levy.html,2010-03-23T01:26:10+0000,Group of Twenty,Banks and Banking | Taxation | Subprime Mortgage Crisis,U.S. Proposals for Taxes on Banks to Cover the Bailouts Gain Ground in Europe,Germany and Britain both plan levies on banks to offset the cost of any future bailouts.,2
https://dealbook.nytimes.com/2010/03/23/berkshire-buying-southern-alcohol-distributor/,2010-03-23T10:38:28+0000,Berkshire Hathaway Inc,,Berkshire Buys Beer and Wine Distributor,"Berkshire Hathaway announced late Monday that McLane, its subsidiary, had struck a deal to acquire Kahn Ventures, which distributes wine, beer and spirits in Georgia and North Carolina. The company did not disclose how much it had agreed to pay.",2
https://www.nytimes.com/2010/03/24/business/global/24subsidy.html,2010-03-23T17:53:00+0000,AIRBUS INDUSTRIE | World Trade Organization | Boeing Co,International Trade and World Market | Protectionism (Trade),W.T.O. Affirms Ruling of Improper Airbus Aid,The W.T.O. is also looking into a European complaint that Boeing has benefited improperly from subsidies from its military business.,2
https://dealbook.nytimes.com/2010/03/25/schlumberger-taps-1-billion-deal-for-geoservices/,2010-03-25T09:58:11+0000,Schlumberger Ltd,,Schlumberger Taps $1 Billion Deal for Geoservices,"Schlumberger said Wednesday that it bought a French oil services company for $1.07 billion, The Associated Press reported.",2
https://dealbook.nytimes.com/2010/03/25/bharti-and-zain-finalizing-africa-deal/,2010-03-25T14:34:47+0000,Bharti Airtel | Zain,,Bharti and Zain Completing Africa Deal,"Bharti Airtel announced Thursday that it had completed due diligence as it proceeds toward buying the African assets of Zain, the Kuwait telecommunications company.",2
https://www.nytimes.com/2010/04/05/business/media/05explorer.html,2010-04-05T03:38:48+0000,National Geographic Channel,Prisons and Prisoners | Television | Documentary Films and Programs,Spending a Week in Solitary to Promote a Documentary,The National Geographic Channel’s marketing stunt is borrowed from extreme reality TV — or perhaps a psychology experiment.,2
https://dealbook.nytimes.com/2010/04/06/digg-founder-rose-to-replace-adelson-as-c-e-o/,2010-04-06T10:40:36+0000,Digg.com,,"Rose, Digg’s Founder, to Replace Adelson as C.E.O.","Jay Adelson, chief executive of Digg, the user-driven social news Web site, announced on Monday that he would step down as head of the company. Kevin Rose, Digg’s original founder, will be taking over as the new chief executive.",2
https://dealbook.nytimes.com/2010/04/07/cohens-ex-wife-says-shes-owed-a-piece-of-sac/,2010-04-07T07:45:16+0000,SAC Capital Advisors,,Cohen’s Ex-Wife Says She’s Owed a Piece of SAC,"The ex-wife of Steven A. Cohen, already suing her former husband for millions of dollars in damages, now claims the trader cheated her out a piece of his $12 billion hedge fund empire, Reuters reported.",2
https://www.nytimes.com/2010/04/12/business/global/12drachma.html,2010-04-12T01:19:55+0000,European Central Bank | European Union,Economic Conditions and Trends,Europe Unifies to Assist Greece With Line of Aid,"European leaders provided a long-awaited financial rescue line, offering the country up to $40 billion  to meet its debt obligations. ",2
https://dealbook.nytimes.com/2010/04/19/out-of-the-loop-in-silicon-valley/,2010-04-19T06:27:34+0000,Apple Inc | eBay Inc | Google Inc | Harvard University | Hunch.com | Kleiner Perkins Caufield & Byers | National Venture Capital Assn | Stanford University | Twitter | Yahoo! Inc,,Out of the Loop in Silicon Valley,"In the fast-moving world of high-tech start-ups, the number of women has been slow to change.",2
