web_url,pub_date,organizations,subjects,headline,snippet,group
https://www.nytimes.com/2015/08/18/world/asia/bangkok-explosion.html,2015-08-17T13:09:31+0000,"Erawan Shrine (Bangkok, Thailand)",Bombs and Explosives | Terrorism,Bangkok Bomb Attack at Popular Shrine Kills at Least 20,The blast appeared to be the worst by far in a series of explosions that have disrupted the country since the military seized power in May 2014.,2
https://www.nytimes.com/2015/08/19/business/dealbook/promontory-financial-settles-with-new-york-regulator.html,2015-08-18T19:07:40+0000,Promontory Financial Group | Standard Chartered Bank PLC | Department of Financial Services (NYS),Banking and Financial Institutions | Consultants,Promontory Financial Settles With New York Regulator,The firm agrees to admit that its actions on behalf of the British bank Standard Chartered did not meet current consulting requirements.,2
https://www.nytimes.com/2015/08/23/business/media/liz-perle-writer-and-former-publishing-executive-dies-at-59.html,2015-08-22T01:29:13+0000,Common Sense Media,Deaths (Obituaries) | Books and Literature | Book Trade and Publishing,"Liz Perle, Writer and Former Publishing Executive, Dies at 59","Ms. Perle was co-founder of Common Sense Media, a nonprofit that helps children engage with the digital world responsibly.",2
https://www.nytimes.com/2015/08/26/business/energy-environment/midwest-gasoline-prices-likely-to-ease-after-a-bp-refinery-is-restarted.html,2015-08-25T21:22:38+0000,BP Plc,"Oil (Petroleum) and Gasoline | Refineries | Prices (Fares, Fees and Rates)",Midwest Gasoline Prices to Normalize After BP Refinery Repair,Gas prices in the Great Lakes states had jumped after a distillation unit at a BP refinery outside Chicago broke down on Aug. 8.,2
https://www.nytimes.com/2015/08/29/business/smallbusiness/labor-board-ruling-on-joint-employers-leaves-some-companies-scratching-their-heads.html,2015-08-28T19:28:18+0000,National Labor Relations Board | National Federation of Independent Business | AMERICAN FEDERATION OF LABOR-CONGRESS OF INDUSTRIAL ORGANIZATIONS,Franchises | Hiring and Promotion | Labor and Jobs | Temporary Employment | Organized Labor | Fast Food Industry,Labor Board Ruling on Joint Employers Leaves Some Companies Scratching Their Heads,"Some fear the decision, which is likely to face legal challenges, could threaten the business model of staffing agencies, subcontractors and franchise operators.",2
https://www.nytimes.com/2015/09/02/business/media/vice-media-lands-carmelo-anthony-for-new-sports-channel.html,2015-09-01T15:00:41+0000,"Vice Media Inc | Clubhouse, The (TV Network)",Web-Original Programming | Athletics and Sports | Television,Vice Media Lands Carmelo Anthony for New Sports Channel,The New York Knicks star will examine sports cultures around the world in a video series called “Stay Melo.”,2
https://www.nytimes.com/2015/09/22/business/hbo-longtime-emmy-favorite-reigns-supreme.html,2015-09-22T00:46:11+0000,Home Box Office,"Emmy Awards | Television | Video Recordings, Downloads and Streaming","HBO, Longtime Emmy Favorite, Reigns Supreme",New rules and openings in major categories help explain the premium cable network’s dominance as it won heavily for “Game of Thrones” and “Veep.”,2
https://www.nytimes.com/2015/09/24/business/international/volkswagen-chief-martin-winterkorn-resigns-amid-emissions-scandal.html,2015-09-23T15:13:57+0000,Volkswagen AG,Fuel Emissions (Transportation) | Automobiles | Diesel Power | Greenhouse Gas Emissions | Frauds and Swindling | Appointments and Executive Changes | Air Pollution,Volkswagen C.E.O. Martin Winterkorn Resigns Amid Emissions Scandal,The move came less than a week after the company admitted that some diesel cars in the United States contained software designed to evade emissions tests.,2
https://www.nytimes.com/2015/09/25/business/media/empire-draws-16-million-viewers-for-season-2-premiere.html,2015-09-24T16:40:19+0000,Fox Broadcasting Co,Ratings (Audience Measurement) | Television,‘Empire’ Draws 16.2 Million Viewers for Season 2 Premiere,"The show’s success last year caught nearly the entire industry by surprise and is providing Fox, which has struggled in the ratings, with a needed hit.",2
https://www.nytimes.com/2015/09/25/business/dealbook/deutsche-bank-picks-goldman-executive-as-bank-and-insurance-adviser.html,2015-09-24T22:07:12+0000,Deutsche Bank AG,Appointments and Executive Changes,Deutsche Bank Picks Goldman Executive as Bank and Insurance Adviser,Celeste Guth will co-head of the global financial institutions group beside Tadhg Flood.,2
https://www.nytimes.com/2015/09/29/technology/momentum-grows-for-jack-dorsey-of-square-to-also-run-twitter.html,2015-09-28T15:43:09+0000,Twitter | Square Inc | Rizvi Traverse Management LLC,Social Media | Appointments and Executive Changes,Momentum Grows for Jack Dorsey to Be Twitter’s Permanent C.E.O.,"There has been concern that he would be too distracted by Square, the payments company where he is chief executive, but some investors say he is the right man for the job — both of them.",2
https://www.nytimes.com/2015/10/01/technology/personaltech/a-grab-bag-of-software-for-the-apple-watch-upgrade.html,2015-09-30T18:48:07+0000,Apple Inc,Mobile Applications | Wearable Computing | Watches and Clocks,A Grab Bag of Software for the Apple Watch Upgrade,"Apps recommended for watchOS 2 include the forecaster Carrot Weather, Citymapper for various modes of travel and the recording program Just Press Record.",2
https://www.nytimes.com/2015/10/21/business/dealbook/hedge-fund-assets-decline-by-biggest-amount-since-financial-crisis.html,2015-10-20T17:43:58+0000,Bain Capital | Carlyle Group LP | Cheniere Energy Inc | Claren Road Asset Management LLC | Fortress Investment Group L.L.C | Glenview Capital Management LLC | Pershing Square Capital Management | Spruce Alpha Fund LP | Valeant Pharmaceuticals International Inc,Hedge Funds,Hedge Fund Assets Decline by Biggest Amount Since Financial Crisis,"The total amount of money that hedge fund managers have available to invest in stocks, bonds, commodities and currencies shrank by $95 billion in the third quarter.",2
https://www.nytimes.com/2015/10/26/business/general-motors-uaw-labor-contract-agreement.html,2015-10-26T05:10:45+0000,General Motors | United Automobile Workers,Automobiles | Organized Labor,General Motors and U.A.W. Reach Tentative Contract Accord,"The announcement, minutes before the previous agreement was set to expire, follows a labor accord last week with Fiat Chrysler.",2
https://www.nytimes.com/2015/10/29/business/dealbook/hyatt-is-said-to-be-in-talks-to-acquire-starwood-hotels.html,2015-10-28T18:44:30+0000,Hyatt Hotels Corp | Starwood Hotels & Resorts Worldwide Inc,"Hotels and Travel Lodgings | Mergers, Acquisitions and Divestitures",Hyatt Is Said to Be in Talks to Acquire Starwood Hotels,A potential sale of Starwood comes as the company reported on Wednesday a decline in earnings in the quarter.,2
https://www.nytimes.com/2015/11/02/business/media/bmg-expected-to-announce-deal-with-the-pop-label-s-curve.html,2015-11-02T01:34:50+0000,BMG Entertainment | S-Curve (Music Group),"Music | Mergers, Acquisitions and Divestitures",BMG Expected to Announce Deal With the Pop Label S-Curve,BMG plans to acquire S-Curve’s recorded music and publishing catalogs. The deal is estimated to be worth at least $10 million.,2
https://www.nytimes.com/2015/11/03/business/international/spanish-companys-moves-in-ireland-hit-tax-and-political-hot-buttons.html,2015-11-02T20:52:00+0000,Grifols SA | European Union,Tax Shelters | Relocation of Business,Spanish Company’s Moves in Ireland Hit Tax and Political Hot Buttons,"By stepping up its activities in Dublin, Grifols, a medical products maker, has waded into issues of concern in the European Union and back home in Barcelona.",2
https://www.nytimes.com/2015/11/04/world/asia/china-economic-growth-xi.html,2015-11-03T12:44:30+0000,Communist Party of China | National People's Congress (China),Economic Conditions and Trends | Gross Domestic Product,"China Aims for 6.5% Economic Growth Over Next 5 Years, Xi Says",The target is an apparent attempt to temper expectations that the nation’s economy will rebound to anything near the double-digit growth of recent decades.,2
https://www.nytimes.com/2015/11/10/business/energy-environment/shift-to-lower-carbon-energy-is-too-slow-report-warns.html,2015-11-10T01:00:04+0000,International Energy Agency,Greenhouse Gas Emissions | Global Warming | Alternative and Renewable Energy | Oil (Petroleum) and Gasoline,"Shift to Lower-Carbon Energy Is Too Slow, I.E.A. Report Warns","Low oil prices could exacerbate the threat to global warming by slowing the transition to cleaner power, according to the International Energy Agency.",2
https://www.nytimes.com/2015/11/13/business/dealbook/a-global-academys-crash-course-makes-angels-out-of-investors.html,2015-11-12T22:17:14+0000,Angel Labs,Venture Capital | Entrepreneurship | Start-ups,A Global Academy’s Crash Course Makes Angels Out of Investors,Angel Labs has organized workshops in more than 38 countries for prospective investors who want to learn how to size up entrepreneurs and their ideas.,2
https://www.nytimes.com/2015/11/17/business/dealbook/study-strongly-links-baltimore-mortgage-denials-to-race.html,2015-11-17T03:01:07+0000,National Community Reinvestment Coalition | Consumer Financial Protection Bureau,Mortgages | Blacks | Black People | Banking and Financial Institutions | Race and Ethnicity | Personal Finances,Study Strongly Links Baltimore Mortgage Denials to Race,A report from the National Community Reinvestment Coalition says the racial makeup of a neighborhood is the best predictor of whether a mortgage is made in Baltimore.,2
https://www.nytimes.com/2015/11/20/business/dealbook/yahoo-pressured-to-keep-alibaba-stake-and-sell-core-business.html,2015-11-19T13:50:27+0000,Yahoo! Inc | Starboard Value LP | Alibaba Group Holding Ltd,"Shareholder Rights and Activism | Mergers, Acquisitions and Divestitures | Corporate Taxes",Yahoo Pressured to Keep Alibaba Stake and Sell Core Business,"As questions arise over taxes on the sale of Yahoo’s stake in Alibaba, Starboard Value is urging Yahoo to sell its core advertising business instead.",2
https://bits.blogs.nytimes.com/2015/11/24/alphabet-trying-to-mix-heft-with-start-up-agility/,2015-11-25T00:11:27+0000,Alphabet Inc | Google Inc | Niantic Inc,"Computers and the Internet | Corporations | Entrepreneurship | Mergers, Acquisitions and Divestitures | Start-ups",Alphabet Trying to Mix Heft With Start-Up Agility,The shape of the company that used to be called Google is starting to become more apparent. What is not so clear is whether a new kind of Google can operate more effectively than the old.,2
https://www.nytimes.com/2015/11/25/business/takata-said-to-have-manipulated-testing-data-for-troubled-airbag-inflaters.html,2015-11-25T04:51:41+0000,Takata Corp,Automobile Safety Features and Defects | Frauds and Swindling | Ethics and Official Misconduct,Takata Said to Have Manipulated Testing Data for Troubled Airbag Inflaters,"The manipulation involved tests intended to demonstrate compliance with automakers’ design specifications, a person with direct knowledge of internal company documents said.",2
https://www.nytimes.com/2015/12/01/business/international/petrobras-chairman-steps-down.html,2015-11-30T17:56:06+0000,Petroleo Brasileiro SA Petrobras | Vale S A,Oil (Petroleum) and Gasoline | Corruption (Institutional),Petrobras Chairman Steps Down,Murilo Ferreira was said to have clashed with the energy giant’s chief executive over cost-cutting and how to put into effect the company’s plan to raise more than $57 billion through asset sales.,2
https://www.nytimes.com/2015/12/04/business/dealbook/andreessen-horowitz-to-invest-in-nootropics-start-up.html,2015-12-03T20:47:39+0000,Andreessen Horowitz,Start-ups | Drugs (Pharmaceuticals),Andreessen Horowitz to Invest in Nootropics Start-Up,"The firm leads a $2 million seed investment in Nootrobox, a company that sells nootropics, which are substances that might improve the way the mind works.",2
https://www.nytimes.com/2015/12/04/technology/zuckerberg-explains-the-details-of-his-philanthropy.html,2015-12-04T00:23:25+0000,Facebook Inc | Chan Zuckerberg Initiative LLC,Philanthropy | Corporate Taxes,Mark Zuckerberg Defends Structure of His Philanthropic Outfit,"A limited liability corporation, he says, offers flexibility for the mission he and his wife have chosen, not a way to avoid taxes.",2
https://www.nytimes.com/2015/12/08/business/dealbook/ge-electrolux-appliances.html,2015-12-07T09:12:34+0000,Electrolux AB | General Electric Company | Justice Department | Frigidaire | LG (Parent) | Samsung Group | Whirlpool Corporation,"Antitrust Laws and Competition Issues | Mergers, Acquisitions and Divestitures | Home Appliances | Ovens and Stoves | Suits and Litigation (Civil)",General Electric Calls Off Sale of Appliance Unit to Electrolux,"The Justice Department had sued in July to stop the deal, saying the transaction would reduce competition and increase prices.",2
https://www.nytimes.com/2015/12/12/your-money/pushing-aside-401-k-s-for-mandatory-savings-plans.html,2015-12-11T13:57:07+0000,Securities Industry and Financial Markets Assn | AARP,"Pensions and Retirement Plans | Retirement | 401(k), 403(b) and 457 Plans | Elderly",Pushing Aside 401(k)’s for Mandatory Savings Plans,Worries about increased longevity and a troubled Social Security system are driving support for mandatory retirement savings plans.,2
https://www.nytimes.com/2015/12/17/business/ge-expects-growth-in-its-earnings-in-an-uncertain-2016.html,2015-12-17T02:02:09+0000,General Electric Company,"Economic Conditions and Trends | Mergers, Acquisitions and Divestitures",G.E. Expects Growth in Its Earnings in an Uncertain 2016,"General Electric expects the next year to be one of economic uncertainty and geopolitical turmoil. For itself, however, it expects double-digit growth.",2
https://www.nytimes.com/2015/12/18/automobiles/navigation-systems-still-show-the-way-but-also-make-the-route-safer.html,2015-12-17T21:26:52+0000,Ford Motor Co | Nokia Oyj | TomTom NV,Driverless and Semiautonomous Vehicles | Navigation | Automobile Safety Features and Defects | Mobile Applications,"Navigation Systems Still Show the Way, but Also Make the Route Safer","Systems include information like the weather, congestion and road curvature, but are also starting to control braking and gear selection without driver input.",2
https://www.nytimes.com/2015/12/22/business/dealbook/carl-icahn-raises-offer-for-pep-boys.html,2015-12-21T16:45:04+0000,Pep Boys | BRIDGESTONE Corporation,"Automobiles | Mergers, Acquisitions and Divestitures",Carl Icahn Raises Offer for Pep Boys,"The $919 million cash offer caused the car-parts and servicing chain to terminate its agreement to be acquired by Bridgestone, the tire company.",2
https://www.nytimes.com/2015/12/22/business/toshiba-plans-to-cut-7800-jobs-as-it-warns-of-huge-loss.html,2015-12-21T17:02:21+0000,TOSHIBA Corporation,Layoffs and Job Reductions | Electronics,"Toshiba Plans to Cut 7,800 Jobs as It Warns of Huge Loss",The company said it would also seek to sell divisions in trying to recover from a $1.2 billion accounting scandal uncovered this year.,2
https://www.nytimes.com/2015/12/23/business/economy/us-economy-gdp-q3-final.html,2015-12-22T13:35:11+0000,National Assn of Realtors | Commerce Department,United States Economy | Real Estate and Housing (Residential) | Interest Rates | Consumer Behavior,Final 3rd-Quarter Estimate Shows U.S. Economy Growing 2%,"Economic growth was revised down slightly to 2 percent, from 2.1 percent, the government said in its revision of the data.",2
https://www.nytimes.com/2015/12/25/technology/security-experts-and-officials-diverge-on-isis-as-hacking-threat.html,2015-12-24T23:45:24+0000,Islamic State in Iraq and Syria (ISIS) | Lizard Squad | Twitter,Cyberwarfare and Defense | Terrorism,Security Experts and Officials Diverge on ISIS as Hacking Threat,"Officials wonder aloud if public infrastructure could be digitally disabled, but researchers say ISIS is not nearly so sophisticated, or inclined.",2
https://bits.blogs.nytimes.com/2015/12/31/its-an-unobtrusive-assistant-whispering-in-your-ear-not-little-brother/,2015-12-31T22:26:03+0000,OrCam Technologies Ltd,Computer Vision | Privacy,It’s an Unobtrusive Assistant Whispering in Your Ear (Not Little Brother),"Can OrCam, an Israeli company, avoid the privacy criticism generated by Google Glass?",2
https://bits.blogs.nytimes.com/2016/01/04/as-uber-stumbles-german-rivals-prosper/,2016-01-04T11:30:59+0000,Uber Technologies Inc,Car Services and Livery Cabs | Regulation and Deregulation of Industry,"As Uber Stumbles, German Rivals Prosper","German ride-booking services, often in collaboration with licensed taxi operators, have expanded rapidly, taking advantage of local regulatory and cultural know-how to succeed just as Uber has had to retreat.",2
https://bits.blogs.nytimes.com/2016/01/04/yahoo-shuts-down-its-video-portal/,2016-01-04T23:33:51+0000,Yahoo! Inc,"Video Recordings, Downloads and Streaming | Web-Original Programming",Yahoo Shuts Down Its Video Portal,The end of Yahoo Screen is a sign of the Internet company’s shrinking video ambitions.,2
https://www.nytimes.com/2016/01/12/business/international/belgium-eu-tax-break.html,2016-01-11T12:00:31+0000,European Commission | European Union,Corporate Taxes,Belgium’s Tax Break to Multinational Companies Is Ruled Illegal,The European Commission will require the Belgian government to recover a total of $765 million in unpaid taxes from at least 35 companies.,2
https://www.nytimes.com/2016/01/14/business/smallbusiness/no-business-too-small-to-be-hacked.html,2016-01-13T18:36:53+0000,"5050 Skatepark (Staten Island, NY) | Rokenbok Education",Computer Security | Small Business | Cyberattacks and Hackers,No Business Too Small to Be Hacked,"Small companies can strengthen security by taking relatively inexpensive and simple steps, either on their own or with the help of outside firms.",2
https://www.nytimes.com/2016/01/14/business/ailing-valeant-chiefs-return-date-is-uncertain.html,2016-01-14T01:19:25+0000,Valeant Pharmaceuticals International Inc,Appointments and Executive Changes | Drugs (Pharmaceuticals),Ailing Valeant Chief’s Return Date Is Uncertain ,"The drug maker’s acting C.E.O., Howard B. Schiller, said it was uncertain when J. Michael Pearson, who Valeant said had been hospitalized with severe pneumonia, would be back.",2
https://bits.blogs.nytimes.com/2016/01/15/daily-report-why-intels-earnings-shouldnt-be-ignored/,2016-01-15T14:36:37+0000,Foursquare | Intel Corporation,Company Reports | Computer Chips | Computers and the Internet,Daily Report: Why Intel’s Earnings Shouldn’t Be Ignored,"Why the financial reports of Intel, one of the largest suppliers of chips to PCs, still matters to the broader technology industry.",2
https://www.nytimes.com/2016/01/16/business/dealbook/stock-markets-wall-street-global-selloff.html,2016-01-15T18:32:51+0000,Federal Reserve System,Stocks and Bonds | United States Economy | Oil (Petroleum) and Gasoline | Recession and Depression | Economic Conditions and Trends,Stock Market Ends Sharply Lower as Worries About Economy Surface,"The benchmark Standard & Poor’s 500-stock index has slipped 8 percent this year, as concerns grow that the United States economy may be on the verge of a slowdown.",2
https://www.nytimes.com/2016/01/16/technology/alphabet-shakes-up-its-robotics-division.html,2016-01-15T19:40:02+0000,Alphabet Inc | Google Inc,Robots and Robotics | Driverless and Semiautonomous Vehicles,Alphabet Shakes Up Its Robotics Division,The holding company that owns Google is moving the unit from a stand-alone division to a piece of X research and putting a new focus on robots.,2
https://www.nytimes.com/2016/01/29/business/dealbook/deutsche-bank-loss-2015.html,2016-01-28T08:53:18+0000,Deutsche Bank AG,Company Reports | Fines (Penalties),Deutsche Bank Says Managers Won’t Get Bonuses Amid Record Loss,"Germany’s biggest bank affirmed the $7.4 billion full-year loss it had previewed last week, and it said that management and shareholders would share the pain.",2
https://www.nytimes.com/2016/02/05/business/media/new-york-times-q4-earnings-newsroom-strategy.html,2016-02-04T13:30:41+0000,New York Times Company,Company Reports,New York Times Co. Announces Newsroomwide Strategy Review,The company highlighted digital growth in the fourth quarter but said revenue was flat because of its declining print business.,2
https://www.nytimes.com/2016/02/13/business/dealbook/troubled-dickstein-shapiro-law-firm-to-merge-with-blank-rome.html,2016-02-12T18:24:33+0000,Dickstein Shapiro LLP | Blank Rome LLP,"Mergers, Acquisitions and Divestitures | Law and Legislation | Lobbying and Lobbyists",Troubled Dickstein Shapiro Law Firm to Merge With Blank Rome,"Dickstein, plagued by partner defections and legal woes, once had 400 lawyers in five offices specializing in regulatory and intellectual property.",2
https://www.nytimes.com/2016/02/13/business/takata-discarded-evidence-of-airbag-ruptures-as-early-as-2000.html,2016-02-13T02:21:11+0000,Takata Corp,Automobile Safety Features and Defects | Falsification of Data | Engineering and Engineers,Takata Discarded Evidence of Airbag Ruptures as Early as 2000,A former Takata airbag engineer testified that the company’s airbags began rupturing in internal testing as many as 16 years ago.,2
https://www.nytimes.com/2016/02/17/business/dealbook/federal-reserves-kashkari-says-banks-still-too-big-to-fail.html,2016-02-16T17:33:18+0000,Federal Reserve Bank of Minneapolis | Goldman Sachs Group Inc,Banking and Financial Institutions | Regulation and Deregulation of Industry | Dodd-Frank Wall Street Reform and Consumer Protection Act (2010),Fed’s Neel Kashkari Says Banks Are ‘Still Too Big to Fail’,"The Minneapolis Fed president, a key Treasury official during the financial crisis, called for reining in banks to address a “risk to our economy.”",2
https://www.nytimes.com/2016/02/20/business/justice-department-calls-apples-refusal-to-unlock-iphone-a-marketing-strategy.html,2016-02-19T19:26:50+0000,Apple Inc | Justice Department | Federal Bureau of Investigation,"Privacy | Surveillance of Citizens by Government | San Bernardino, Calif, Shooting (2015) | iPhone | Computer Security",Justice Department Calls Apple’s Refusal to Unlock iPhone a ‘Marketing Strategy’,Prosecutors offered a sharp rejoinder to Apple’s position that refusing to help the government was a matter of protecting customers’ privacy.,2
https://www.nytimes.com/2016/02/22/business/treasury-auctions-set-for-the-week-of-feb-22.html,2016-02-21T22:53:35+0000,Treasury Department,"Municipal Bonds | Tax Credits, Deductions and Exemptions | Auctions",Treasury Auctions Set for the Week of Feb. 22,The following tax-exempt fixed-income issues are scheduled for pricing this week.,2
https://www.nytimes.com/2016/02/25/technology/deadpool-technology-lands-in-patent-fight.html,2016-02-24T14:56:49+0000,Digital Domain,Inventions and Patents | Movies | Suits and Litigation (Civil),‘Deadpool’ Technology Lands in Patent Fight,Two companies are fighting over ownership of an animation technology used in the making of the surprise hit film.,2
https://www.nytimes.com/2016/02/27/business/energy-environment/eni-earnings-oil.html,2016-02-26T09:20:13+0000,ENI S.p.A,Company Reports | Oil (Petroleum) and Gasoline,"Eni, Hit by Falling Oil Prices, Reports $9.4 Billion Loss","The Italian oil giant is the latest energy company to be hit by sharply lower crude prices, which have slashed revenue and led to asset write-downs.",2
https://www.nytimes.com/2016/03/08/technology/justice-dept-appeals-ruling-in-apple-iphone-case-in-brooklyn.html,2016-03-07T23:58:15+0000,Apple Inc | Justice Department,Surveillance of Citizens by Government | Privacy | Software | iPhone,Justice Dept. Appeals Ruling in Apple iPhone Case in Brooklyn,"The Justice Department said a federal judge had erred in not ordering Apple to unlock a drug dealer’s iPhone, in a case being watched by lawyers and experts on both sides of the encryption debate.",2
https://www.nytimes.com/2016/03/14/business/self-driving-cars-wall-street-supervision-and-more-tech-at-sxsw.html,2016-03-14T01:12:55+0000,Commerce Department | Federal Reserve Bank of New York,Banking and Financial Institutions | Inflation (Economics) | Driverless and Semiautonomous Vehicles | Consumer Price Index,"Self-Driving Cars, Wall Street Supervision and More Tech at SXSW","A look at government economic reports, congressional hearings, earnings reports and central banking moves expected in the coming week.",2
https://www.nytimes.com/2016/03/19/technology/twitter-rules-out-long-tweets-sticking-to-140-character-limit.html,2016-03-18T18:49:24+0000,Twitter,Social Media | Computers and the Internet,"Twitter Rules Out Long Tweets, Sticking to 140-Character Limit","Jack Dorsey, chief executive of Twitter, said in an interview with the “Today” show on Friday that the service liked brevity.",2
https://www.nytimes.com/2016/03/24/business/sec-orders-exxon-mobil-shareholder-vote-on-to-climate-data.html,2016-03-24T02:38:23+0000,Exxon Mobil Corp | Securities and Exchange Commission,Global Warming | Shareholder Rights and Activism,S.E.C. Orders Exxon Mobil Shareholder Vote on Climate Data,"A resolution, if approved, would force the energy giant to outline for investors how its profitability may be affected by climate change.",2
