web_url,pub_date,organizations,subjects,headline,snippet,group
https://www.nytimes.com/2012/09/06/health/a-clash-over-vertos-medicals-spine-treatment.html,2012-09-06T00:57:00+0000,Vertos Medical Inc,Surgery and Surgeons | Medical Devices | Spine (Body Part) | Back (Human Body Part) | Clinical Trials,A Clash Over a Spine Treatment,"A researcher in a clinical trial for a device to treat back pain has been intimidated by the device’s maker, Vertos Medical, from reporting his negative findings.",2
https://www.nytimes.com/2012/09/12/business/media/grey-poupon-mustard-ups-the-ante-on-its-highbrow-image.html,2012-09-12T02:38:12+0000,Kraft Foods Inc,Mustard | Online Advertising | ADVERTISING AND MARKETING,Grey Poupon Ups the Ante on Assuming an Elite Image,A centuries-old mustard brand will use a Facebook campaign to ensure that its users meet its standards.,2
https://www.nytimes.com/2012/09/13/business/global/13iht-banks13.html,2012-09-12T10:58:37+0000,European Central Bank | European Union,Euro (Currency) | European Sovereign Debt Crisis (2010- ) | Banking and Financial Institutions,"Weary of Crisis, but Wary of Change",A proposal to give the European Union more control over banking has stirred up dissent from countries that have doubts about the plan’s practicality.,2
https://www.nytimes.com/2012/09/15/business/american-retailers-expanding-to-canada.html,2012-09-15T01:18:23+0000,Nordstrom Inc | Wal-Mart Stores Inc | Target Corporation | J Crew Group,Shopping and Retail,American Retailers Face Challenges in Expanding to Canada,"American retailers extending their reach northward may seem like an obvious move, but until recently, the Canadian market was hard to crack.",2
https://www.nytimes.com/2012/09/19/business/media/samsung-apple-fight-moves-to-the-marketing-arena.html,2012-09-19T01:01:23+0000,Apple Inc | Samsung Group,iPhone | ADVERTISING AND MARKETING,Samsung-Apple Fight Moves to Marketing,"Samsung’s campaign takes on the iPhone 5 directly, claiming its new Galaxy phone is better.",2
https://www.nytimes.com/2012/09/26/business/media/barnes-noble-tablets-aim-for-niche-below-ipad.html,2012-09-26T05:00:07+0000,Barnes & Noble Inc,Barnes & Noble Nook | E-Books and Readers | Tablet Computers | Video Recordings and Downloads,Barnes & Noble Tablets Aim for Niche Below iPad,"In a moves meant to expand its digital offerings, the company on Tuesday introduced two new color tablets and said a video store for its Nook products would make its debut this fall.",2
https://www.nytimes.com/2012/10/11/technology/start-ups/for-some-drivers-electric-motorcycle-could-be-the-best-of-both-worlds.html,2012-10-10T23:45:17+0000,Lit Motors,"Electric and Hybrid Vehicles | Motorcycles, Motor Bikes and Motorscooters | Start-ups","For Some Drivers, an Electric Motorcycle Could Be the Best of Both Worlds","The C-1, being built by Lit Motors, is a bike encased in a metal shell that is meant to provide the convenience of a motorcycle with the amenities of a car.",2
https://www.nytimes.com/2012/10/19/technology/google-shares-drop-after-earnings-disappoint.html,2012-10-18T17:20:21+0000,Google Inc,Company Reports | Stocks and Bonds,Shares Fall Sharply as Google Earnings Are Released Early,"Google’s quarterly results, released early by mistake, reflected losses at Motorola Mobility and plummeting prices for clicks on ads.",2
https://www.nytimes.com/2012/11/14/technology/at-microsoft-sinofsky-seen-as-smart-but-abrasive.html,2012-11-14T02:56:24+0000,Microsoft Corporation | Apple Inc,"Software | Computers and the Internet | Windows (Operating System) | Suspensions, Dismissals and Resignations",Ex-Windows Chief Seen as Smart but Abrasive,"An accumulation of run-ins with other company leaders led to Steven Sinofsky’s departure, according to several current and former Microsoft executives.",2
https://www.nytimes.com/2012/11/14/business/media/babar-king-of-elephants-celebrates-80th-anniversary.html,2012-11-14T03:01:30+0000,Clifford Ross Co | Nelvana Ltd,ADVERTISING AND MARKETING | Babar (Fictional Character) | Books and Literature | Children and Childhood | Toys,A New Coronation for the King of the Elephants,"An elaborate promotional campaign seeks to reintroduce the Babar brand to American children ahead of 2013, the 80th anniversary of the United States publication of the first Babar book.",2
https://www.nytimes.com/2012/11/17/business/global/despite-accord-spill-aftermath-shadows-bp.html,2012-11-16T17:29:20+0000,BP Plc,Fines (Penalties) | Company Reports | Gulf of Mexico Oil Spill (2010) | Oil (Petroleum) and Gasoline | Suits and Litigation,"Despite Accord, Spill Aftermath Shadows BP","Thursday’s agreement is another step in the company’s struggle to improve its image, but it was not the comprehensive settlement that the company and investors were hoping for.",2
https://www.nytimes.com/2012/11/21/realestate/commercial/liberty-travel-opens-a-flagship-in-midtown-manhattan.html,2012-11-21T01:24:19+0000,Liberty Travel,Travel and Vacations | Travel Agencies and Agents,A Travel Agency Docks a Flagship in Midtown,"Bucking the trend of travel services shutting down in the face of online competition, Liberty Travel has opened a 10,000-square-foot store on Madison Avenue.",2
https://www.nytimes.com/2012/12/07/technology/communications-treaty-hung-up-on-internet-issue.html,2012-12-06T19:57:35+0000,Internet Corp for Assigned Names and Numbers | United Nations | International Telecommunication Union,Regulation and Deregulation of Industry | Computers and the Internet,Drafters of Communications Treaty Are Split on Issue of Internet Governance,"A United States proposal to keep the Internet in the hands of the private sector is being resisted by some delegates, including those from Russia and some African and Middle Eastern nations.",2
https://www.nytimes.com/2012/12/21/business/global/ice-deal-for-nyse-creates-global-powerhouse.html,2012-12-21T01:59:40+0000,NYSE Euronext | IntercontinentalExchange Inc,"Mergers, Acquisitions and Divestitures | Derivatives (Financial Instruments) | Futures and Options Trading | Computers and the Internet | Stocks and Bonds | High-Frequency and Flash Trading | Financial Brokers | Banking and Financial Institutions",ICE Deal for N.Y.S.E. Creates Global Powerhouse,"The New York Stock Exchange once had a monopoly on stock trading, but is no longer the center of the financial world.",2
https://www.nytimes.com/2012/12/31/business/media/maxim-magazine-focuses-on-military-veterans-and-their-families.html,2012-12-31T00:20:24+0000,Maxim,United States Defense and Military Forces | ADVERTISING AND MARKETING | Magazines,Maxim Recruits a Readership in Uniform,"Maxim, a magazine featuring adolescent humor and plenty of scantily clad actresses, has courted the armed forces, veterans and their families as a source of growing readership.",2
https://www.nytimes.com/2012/12/31/business/media/in-2013-engineering-a-reversal-of-fortune-for-media-leaders.html,2012-12-31T01:43:02+0000,CNN | New York Times | Warner Brothers | Time Inc | Martha Stewart Living Omnimedia Inc,Media | News and News Media,Engineering a Reversal of Fortune in 2013,"Given the number of changes in the media industry, the coming year is particularly important for a group of leaders who confront steep challenges ahead.",2
https://www.nytimes.com/2013/01/04/business/energy-environment/congress-extends-incentives-for-biodiesel-industry.html,2013-01-04T00:30:09+0000,Senate | House of Representatives,"Biodiesel Fuel | Prices (Fares, Fees and Rates) | Oil (Petroleum) and Gasoline | Alternative and Renewable Energy | Tax Credits, Deductions and Exemptions",Congress Renews Credit for Biodiesel Industry,"The fiscal package passed this week included a retroactive reinstatement of a dollar-a-gallon credit going back to January 2012, when it lapsed.",2
https://www.nytimes.com/2013/01/10/business/gm-chief-sees-improvement-in-market-share.html,2013-01-09T17:06:06+0000,General Motors,Automobiles,G.M. Chief Expects To Regain Market Share ,"Daniel Akerson, the chief executive, said a number of new products should help G.M. gain traction this year after it posted its lowest United States market share in decades.",2
https://www.nytimes.com/2013/01/17/business/moodys-outlook-on-higher-education-turns-negative.html,2013-01-16T22:33:32+0000,Moody's Investors Service Inc,Credit Ratings and Credit Rating Agencies | Colleges and Universities | United States Economy,Moody’s Gives Colleges a Negative Grade,"The credit reporting agency said it had revised its financial outlook for colleges and universities, assigning a negative rating to the entire field.",2
https://www.nytimes.com/2013/01/18/business/how-dell-became-entangled-in-options.html,2013-01-17T19:38:06+0000,Dell Inc,Stock Options and Purchase Plans | Executive Compensation | ACCOUNTING AND ACCOUNTANTS,Dell’s Ups and Downs With Options,"Dell has spent more on share repurchases than it earned throughout its life as a public company, and most of those repurchases were at prices well above current levels.",2
https://www.nytimes.com/2013/02/15/business/airline-consolidation-may-be-costly-to-travelers.html,2013-02-14T23:22:07+0000,US Airways Group Inc | AMERICAN AIRLINES | Justice Department,"Mergers, Acquisitions and Divestitures | Antitrust Laws and Competition Issues | AIRLINES AND AIRPLANES",Service Cuts May Follow Merger of Airlines,"Some consumer advocates are warning that the merger of American Airlines and US Airways, if approved, could bring rising fees and fares as well as service cuts to smaller cities.",2
https://www.nytimes.com/2013/02/23/business/global/the-patron-of-siena-monte-dei-paschi-stumbles.html,2013-02-22T19:50:38+0000,Monte dei Paschi di Siena SpA,Banking and Financial Institutions | Derivatives (Financial Instruments),Patron of Siena Stumbles,Nowhere are Monte dei Paschi’s problems more acutely felt than in Siena. The bank has paid for charitable and civic works for as long as anyone can remember.,2
https://www.nytimes.com/2013/02/26/business/devoted-to-weight-watchers-but-workers-rebel-against-low-wages.html,2013-02-26T01:50:19+0000,Weight Watchers International Inc,Wages and Salaries | Labor and Jobs | Celebrities | ADVERTISING AND MARKETING | Women and Girls,Low Pay at Weight Watchers Stirs Protest as Stars Rake It In,Hundreds of the leading weight-loss company’s rank-and-file workers are waging an open rebellion that has management scrambling to improve working conditions.,2
https://www.nytimes.com/2013/03/05/business/justices-to-take-up-case-on-generic-drug-makers-liability.html,2013-03-04T22:56:43+0000,Mutual Pharmaceutical Co Inc | Supreme Court,Drugs (Pharmaceuticals) | Generic Brands and Products | Suits and Litigation | Consumer Protection | Liability for Products,Justices to Take Up Case on Generic Drug Makers’ Liability,"Karen Bartlett was grievously injured by a mild painkiller, and the Supreme Court will hear arguments this month on whether the maker can be held responsible.",2
https://www.nytimes.com/2013/03/26/business/media/gillette-promotes-a-new-shaver-using-qr-codes.html,2013-03-26T00:30:56+0000,Gillette Co,Shaving and Shavers | ADVERTISING AND MARKETING | Men and Boys,"Shaving Below a Man’s Neck, if That’s What She Wants","Gillette is promoting a new shaving tool for a man’s beard, chest and back by having women express their varying opinions about how much hair a man should have.",2
https://www.nytimes.com/2013/04/11/business/global/european-countries-move-to-toughen-stance-on-tax-evasion.html,2013-04-10T18:56:14+0000,European Union,Tax Shelters | Frauds and Swindling | Corruption (Institutional) | Banking and Financial Institutions | Tax Evasion,Hollande Creates a Prosecutor for Fraud and Vows to End Tax Havens,"As President François Hollande of France made the announcement, Luxembourg said it would begin forwarding  details on foreign clients’ accounts to their home governments.",2
https://www.nytimes.com/2013/04/27/technology/internet-sales-tax-coming-too-late-for-some-stores.html,2013-04-27T00:54:25+0000,AMAZON.COM INC,E-Commerce | Sales and Excise Taxes | Shopping and Retail | Law and Legislation | Small Business,Internet Sales Tax Coming Too Late for Some Stores,"Congress is considering taxing sales made by Internet retailers like Amazon, but some sellers believe it should have been done years ago.",2
https://www.nytimes.com/2013/04/29/us/politics/bill-on-sales-tax-for-internet-purchases-divides-republicans.html,2013-04-29T01:46:43+0000,AMERICANS FOR TAX REFORM,Sales and Excise Taxes | E-Commerce | Law and Legislation | United States Politics and Government | States (US) | Federal Taxes (US),Push to Require Online Sales Tax Divides the G.O.P.,"Antitax groups seem to be losing their influence, as Republican lawmakers’ constituents support legislation that would require Internet retailers to collect sales taxes.",2
https://www.nytimes.com/2013/05/22/realestate/commercial/for-woodbury-common-an-overdue-makeover.html,2013-05-22T00:12:05+0000,Woodbury Common | Simon Property Group Inc,Real Estate (Commercial) | Shopping Centers and Malls,A Magnet for Shoppers Is Getting a Makeover,"Woodbury Common, a labyrinthine outlet complex north of New York City that draws shoppers from all over the world, is preparing for an expansion and an extensive overhaul.",2
https://www.nytimes.com/2013/06/28/business/global/european-banking-deal-is-seen-as-progress-with-flaws.html,2013-06-27T22:09:00+0000,European Monetary Union,European Sovereign Debt Crisis (2010- ) | Banking and Financial Institutions | Regulation and Deregulation of Industry,Europe’s Bank Deal Is Seen as Progress With Flaws,"The agreement is intended to reduce the chance that a bank crisis will create a government debt crisis, but risk to weaker countries remains.",2
https://www.nytimes.com/2013/07/04/business/markets-wait-for-a-twitch-either-way-in-jobs-data.html,2013-07-04T01:54:53+0000,Federal Reserve System,Labor and Jobs | United States Economy | Interest Rates | Stocks and Bonds,Markets Wait for a Twitch Either Way in Jobs Data,"The employment figures for June, which the Labor Department is set to report early Friday, will have broad implications for the market whether they are weak or strong.",2
https://www.nytimes.com/2013/07/12/business/media/new-designation-signifies-i-was-really-a-producer-of-this-film.html,2013-07-11T14:02:09+0000,Producers Guild of America,Movies,New Designation Signifies ‘I Was Really a Producer of This Film’,All six major film studios have approved a special “producer’s mark” to distinguish those who have actually done substantive producing work from those who haven’t.,2
https://www.nytimes.com/2013/07/22/business/global/liberalizing-interest-rates-remains-a-challenge-for-china.html,2013-07-21T19:25:36+0000,People's Bank of China,Interest Rates | Regulation and Deregulation of Industry,Liberalizing Interest Rates Remains a Challenge for China,"The full liberalization of rates, if it does take place, would be a partial but significant shift in the growth model that has come to define China’s rise in the last decade.",2
https://www.nytimes.com/2013/07/23/booming/three-men-three-ages-who-do-you-like.html,2013-07-23T00:41:44+0000,Equal Employment Opportunity Commission,"Discrimination | Age, Chronological | Labor and Jobs | Hiring and Promotion | Research","Three Men, Three Ages. Which Do You Like?",Age discrimination complaints filed with the Equal Employment Opportunity Commission have risen and a method for calculating age discrimination in the workplace and elsewhere remains elusive.,2
https://www.nytimes.com/2013/07/24/business/media/online-a-cereal-maker-takes-an-inclusive-approach.html,2013-07-24T00:30:30+0000,General Mills Inc | Facebook Inc | Kellogg Company,Cereals | ADVERTISING AND MARKETING | Social Media | Diet and Nutrition,"Online, a Cereal Maker Takes an Inclusive Approach",General Mills created a cereal lovers group on Facebook that welcomes mentions and even recipes made with cereals made by its competitors.,2
https://www.nytimes.com/2013/07/26/business/media/congressman-vows-to-introduce-bill-on-radio-royalties.html,2013-07-25T22:25:45+0000,House of Representatives | Clear Channel Communications Inc,Music | Law and Legislation | Radio | Royalties,Congressman Vows to Introduce Bill on Radio Royalties,"Representative Melvin L. Watt, a Democrat from North Carolina, says the measure is an effort to get payment for record companies and artists whose music is played on AM or FM radio.",2
https://www.nytimes.com/2013/08/03/business/global/toyota-quarterly-profit-nearly-doubles.html,2013-08-02T10:28:49+0000,Toyota Motor Corporation,Company Reports | International Trade and World Market,Weakening Yen Helps Toyota Double Its Quarterly Profit,"The Japanese automaker, the largest in the world by sales, raised its full-year profit forecast even as it sold fewer vehicles.",2
https://www.nytimes.com/2013/08/17/business/energy-environment/shale-gas-company-suspends-drilling-in-southern-england.html,2013-08-16T12:55:13+0000,Cuadrilla Resources,"Shale | Demonstrations, Protests, and Riots | Oil (Petroleum) and Gasoline",Shale Gas Company Halts Drilling at British Site,"Cuadrilla Resources, which has been in the forefront of shale gas exploration in northwest England, said that it had made the decision following threats of protests at one of its sites.",2
https://www.nytimes.com/2013/08/22/business/rosalia-mera-co-founder-of-zara-dies-at-69.html,2013-08-22T00:07:04+0000,Zara,Shopping and Retail | Deaths (Obituaries) | Fashion and Apparel,"Rosalia Mera, Co-Founder of Zara, Dies at 69","Ms. Mera was a Spanish entrepreneur who helped start the Zara fashion empire, becoming the world’s richest self-made woman.",2
https://www.nytimes.com/2013/09/04/technology/from-nokia-an-executive-who-knows-all-too-well-the-difficulties-at-hand.html,2013-09-04T01:46:32+0000,Microsoft Corporation | Nokia Oyj,"Mergers, Acquisitions and Divestitures | Cellular Telephones | Appointments and Executive Changes | Smartphones | Software","From Nokia, an Executive Who Knows the Difficulties at Hand","As Nokia’s chief, Stephen Elop took harsh measures to right the company, preventing an even worse outcome, analysts say. But Nokia has not yet halted its slide in market share.",2
https://www.nytimes.com/2013/09/12/technology/personaltech/a-good-office-chair-not-so-different-from-others.html,2013-09-11T20:31:49+0000,Steelcase Inc | Herman Miller Inc,Chairs | Ergonomics,Chair Pitched as Answer to New Ways We Sit on Job,"Steelcase says we need chairs to accommodate the strange new positions we work in these days, but its new model may offer only a slight improvement.",2
https://www.nytimes.com/2013/09/14/business/economy/investors-in-europe-see-a-glass-half-full-and-rising.html,2013-09-13T15:36:28+0000,European Central Bank,Unemployment | European Sovereign Debt Crisis (2010- ),Investors in Europe See a Glass Half Full and Rising,It remains to be seen whether optimism in the face of negatives like high unemployment is rooted in complacency or a belief that the worst is over.,2
https://www.nytimes.com/2013/10/04/business/jobs-report-becomes-a-casualty-of-shutdown.html,2013-10-04T01:44:59+0000,Bureau of Labor Statistics | Bureau of Economic Analysis,United States Economy | Shutdowns (Institutional) | Labor and Jobs | Federal Budget (US) | United States Politics and Government | Stocks and Bonds,Jobs Report Becomes a Casualty of Shutdown,The data vacuum left by the shuttered Labor Department has inspired other outfits that track the labor market to fight for analysts’ attention.,2
https://www.nytimes.com/2013/10/10/business/energy-environment/oecd-head-calls-for-global-effort-against-climate-change.html,2013-10-09T16:42:25+0000,Organization for Economic Cooperation and Development,Greenhouse Gas Emissions,O.E.C.D. Head Calls for Global Effort Against Climate Change,"Ángel Gurría, secretary general of the O.E.C.D., said the world should eliminate all emissions from burning fossil fuels before the century is over.",2
https://www.nytimes.com/video/technology/100000002507136/betting-on-battlefield.html,2013-10-19T21:00:49+0000,Electronic Arts Inc,Computer and Video Games,Betting on Battlefield,"Despite shifts in gaming platforms and public relations issues, Sweden’s Digital Illusions CE is betting millions on the latest version of its first person shooter franchise, Battlefield.",2
https://www.nytimes.com/2013/10/22/technology/personaltech/beats-signature-headphones-get-an-upgrade.html,2013-10-22T20:42:21+0000,Beats Electronics,Headphones and Headsets,Beats’ Signature Headphones Get an Upgrade,"Beats Electronics recently revamped its ubiquitous Beats Studio headphones, which were originally released in 2008.",2
https://www.nytimes.com/2013/10/24/business/international/european-central-bank-vows-thorough-review-of-banks-at-risk.html,2013-10-23T08:11:32+0000,Volkswagen AG,European Sovereign Debt Crisis (2010- ) | Regulation and Deregulation of Industry,E.C.B. Vows Thorough Review of Banks at Risk,The European Central Bank’s yearlong examination of 130 euro zone banks is intended to force weak ones to deal with problems such as bad loans and insufficient capital.,2
https://www.nytimes.com/2013/10/24/business/media/ad-sponsored-editorial-content-draws-regulators-notice.html,2013-10-24T00:17:20+0000,Advertising Self-Regulatory Council | Council of Better Business Bureaus,ADVERTISING AND MARKETING | Regulation and Deregulation of Industry | Conflicts of Interest | Online Advertising,Ad-Sponsored Editorial Content Draws Regulator’s Notice,The use of editorial content for promotional purposes is being scrutinized by an investigative unit administered by the Council of Better Business Bureaus.,2
https://www.nytimes.com/2013/10/26/your-money/health-insurance-options-arent-limited-to-obamacare-exchanges.html,2013-10-25T19:07:46+0000,eHealth Inc,Health Insurance and Managed Care | Patient Protection and Affordable Care Act (2010),Health Insurance Options Aren’t Limited to Government Exchanges,"Most shoppers for health insurance can leave the new exchanges and buy coverage through brokers or company Web sites, but it is unclear if they will find a better deal.",2
https://www.nytimes.com/2013/10/29/automobiles/wheelies-the-rising-sun-edition.html,2013-10-29T10:00:08+0000,Johnson Controls Inc | Nissan Motor Co | Tesla Motors Inc,Automobiles | Antique and Classic Cars,Wheelies: The Rising Sun Edition,"Japanese car sales are up in China for the first time since territorial disputes, and other automotive news.",2
https://www.nytimes.com/2013/10/30/business/media/documentary-association-announces-awards-nominations.html,2013-10-29T19:08:03+0000,International Documentary Assn,"Movies | Documentary Films and Programs | Awards, Decorations and Honors",Documentary Association Announces Awards Nominations,Dominating the feature film nominations were documentaries about issues and politics.,2
https://www.nytimes.com/2013/11/06/business/international/chinas-leaders-confront-economic-fissures.html,2013-11-06T01:49:53+0000,Communist Party of China,Economic Conditions and Trends | Labor and Jobs | Education | Unemployment | Politics and Government,China’s Leaders Confront Economic Fissures,"As it prepares for a critical policy meeting, the Communist Party faces a persistent problem: Jobs abound in China, but not the kind young graduates want.",2
https://www.nytimes.com/2013/11/11/business/supreme-court-to-take-up-challenges-to-union-practices.html,2013-11-10T21:07:53+0000,Supreme Court (US) | Service Employees International Union | Unite Here,Organized Labor | Labor and Jobs | Law and Legislation | Home Health Care,Supreme Court to Take Up Challenges to Union Practices,Two cases this term — involving neutrality agreements with employers and the requirement that home care workers pay fees to unions — could produce significant rulings.,2
https://www.nytimes.com/2013/11/20/business/economy/unavoidable-answer-to-problem-of-climate-change.html,2013-11-19T22:29:46+0000,Global Carbon Project,Nuclear Energy | Greenhouse Gas Emissions | Alternative and Renewable Energy | Coal | Global Warming,Unavoidable Answer for the Problem of Climate Change,"Opponents call attention to the dire risks of nuclear energy, but in the push to reduce reliance on fossil fuels, it may be the world’s best shot.",2
https://www.nytimes.com/2013/11/20/realestate/commercial/arthur-w-zeckendorf.html,2013-11-19T22:40:36+0000,Zeckendorf Realty LP | Terra Holdings,Real Estate and Housing (Residential) | Condominiums | Luxury Goods and Services,Arthur W. Zeckendorf,"Mr. Zeckendorf is a principal, along with his brother, William Lie Zeckendorf, of Zeckendorf Realty, developer of luxury condominiums and retail space in Manhattan.",2
https://www.nytimes.com/2013/12/02/business/media/longtime-tv-consultant-steps-aside-not-down.html,2013-12-01T23:43:54+0000,Sucherman Consulting Group,News and News Media | Television,"Longtime TV Consultant and Recruiter Is Stepping Aside, Not Down","Stuart F. Sucherman, who has helped television networks solve some of their toughest problems, is leaving the chief executive’s suite, but not the consulting group he founded.",2
https://www.nytimes.com/2013/12/07/automobiles/the-2014-lexus-lx-570-a-behemoth-for-a-modern-age.html,2013-12-06T18:27:22+0000,Lexus Division of Toyota Motor Corp,Automobiles | Sports Utility Vehicles and Light Trucks,The 2014 Lexus LX 570: A Behemoth for a Modern Age,"It’s big and thirsty, but for those who can afford it, the 2014 LX 570 combines real-world off-road capability with top-end opulence.",2
